{
  "version": "0.2",
  "run_id": "run_fe31b3c3e2",
  "scenario_id": "toy_lab_v0",
  "run_outcome": "success_safe",
  "metrics": {
    "tasks_completed": 4,
    "planned_task_count": 4,
    "task_latency_ms_p50": 23.02679905157983,
    "task_latency_ms_p95": 30.42516958306819,
    "task_latency_ms_p99": 30.76422353906998,
    "coordination_messages": 4,
    "tasks_completed_after_fault": 2,
    "steps_to_completion_after_first_fault": 7,
    "time_to_first_fault_ms": 154.88785705175346,
    "time_to_recovery_ms": 21.132205390028165,
    "time_to_safe_state_ms": 240.6183834727814,
    "recovery_attempt_count": 0,
    "tasks_pending_at_first_fault": 1,
    "tasks_recovered_after_fault": 2,
    "fault_to_safe_state_event_count": 1,
    "fault_to_recovery_event_count": 1
  },
  "safety": {
    "safety_violation_count": 0,
    "safety_violation_types": [],
    "ponr_violation_count": 0,
    "unsafe_completion_count": 0,
    "unsafe_success_count": 0,
    "constraint_violation_count": 0,
    "deadline_miss_count": 0,
    "resource_conflict_count": 0,
    "invalid_action_count": 0,
    "blocked_action_count": 0
  },
  "coordination_efficiency": {
    "messages_per_completed_task": 1.0,
    "messages_after_fault": 1,
    "retries_per_completed_task": 0.0,
    "duplicate_action_count": 0,
    "wasted_action_count": 0
  },
  "faults": {
    "fault_injected": true,
    "fault_events": [
      "reordered_event"
    ],
    "recovery_ok": true
  },
  "notes": "MAESTRO_REPORT v0.2; thin-slice synthetic trace times (ts) are scenario simulation timestamps in seconds, not wall-clock unless the harness records wall time in ts."
}
