{
  "version": "0.2",
  "run_id": "run_b1b86070fc",
  "scenario_id": "lab_profile_v0",
  "run_outcome": "partial_safe",
  "metrics": {
    "tasks_completed": 4,
    "planned_task_count": 5,
    "task_latency_ms_p50": 60.223481983575695,
    "task_latency_ms_p95": 110.29583336621876,
    "task_latency_ms_p99": 113.09794584492003,
    "coordination_messages": 5,
    "tasks_completed_after_fault": 3,
    "steps_to_completion_after_first_fault": 21,
    "time_to_first_fault_ms": 163.38896575868085,
    "time_to_recovery_ms": 99.42483181839424,
    "time_to_safe_state_ms": null,
    "recovery_attempt_count": 2,
    "tasks_pending_at_first_fault": 1,
    "tasks_recovered_after_fault": 3,
    "fault_to_safe_state_event_count": 0,
    "fault_to_recovery_event_count": 3
  },
  "safety": {
    "safety_violation_count": 0,
    "safety_violation_types": [],
    "ponr_violation_count": 0,
    "unsafe_completion_count": 0,
    "unsafe_success_count": 0,
    "constraint_violation_count": 0,
    "deadline_miss_count": 0,
    "resource_conflict_count": 1,
    "invalid_action_count": 0,
    "blocked_action_count": 0
  },
  "coordination_efficiency": {
    "messages_per_completed_task": 1.25,
    "messages_after_fault": 3,
    "retries_per_completed_task": 0.5,
    "duplicate_action_count": 0,
    "wasted_action_count": 0
  },
  "faults": {
    "fault_injected": true,
    "fault_events": [
      "reordered_event",
      "resource_contention_spike",
      "partial_result",
      "partial_result",
      "reordered_event",
      "drop_completion"
    ],
    "recovery_ok": true
  },
  "notes": "MAESTRO_REPORT v0.2; thin-slice synthetic trace times (ts) are scenario simulation timestamps in seconds, not wall-clock unless the harness records wall time in ts."
}
