{
  "version": "0.2",
  "run_id": "run_93ad6a9ede",
  "scenario_id": "rep_cps_scheduling_v0",
  "run_outcome": "success_safe",
  "metrics": {
    "tasks_completed": 4,
    "planned_task_count": 4,
    "task_latency_ms_p50": 8.247149599510593,
    "task_latency_ms_p95": 11.744547964598695,
    "task_latency_ms_p99": 11.92590259600095,
    "coordination_messages": 4,
    "tasks_completed_after_fault": null,
    "steps_to_completion_after_first_fault": null,
    "time_to_first_fault_ms": null,
    "time_to_recovery_ms": null,
    "time_to_safe_state_ms": 208.8621209580803,
    "recovery_attempt_count": 0,
    "tasks_pending_at_first_fault": null,
    "tasks_recovered_after_fault": 0,
    "fault_to_safe_state_event_count": 0,
    "fault_to_recovery_event_count": 0
  },
  "safety": {
    "safety_violation_count": 0,
    "safety_violation_types": [],
    "ponr_violation_count": 0,
    "unsafe_completion_count": 0,
    "unsafe_success_count": 0,
    "constraint_violation_count": 0,
    "deadline_miss_count": 0,
    "resource_conflict_count": 0,
    "invalid_action_count": 0,
    "blocked_action_count": 0
  },
  "coordination_efficiency": {
    "messages_per_completed_task": 1.0,
    "messages_after_fault": 0,
    "retries_per_completed_task": 0.0,
    "duplicate_action_count": 0,
    "wasted_action_count": 0
  },
  "faults": {
    "fault_injected": false,
    "fault_events": [],
    "recovery_ok": true
  },
  "notes": "MAESTRO_REPORT v0.2; thin-slice synthetic trace times (ts) are scenario simulation timestamps in seconds, not wall-clock unless the harness records wall time in ts."
}
