{
  "version": "0.2",
  "run_id": "run_0d69874f67",
  "scenario_id": "regime_stress_v1",
  "run_outcome": "partial_safe",
  "metrics": {
    "tasks_completed": 2,
    "planned_task_count": 4,
    "task_latency_ms_p50": 5.587005888983112,
    "task_latency_ms_p95": 9.972657981847739,
    "task_latency_ms_p99": 10.362493723435707,
    "coordination_messages": 4,
    "tasks_completed_after_fault": 1,
    "steps_to_completion_after_first_fault": 7,
    "time_to_first_fault_ms": 62.732814170284605,
    "time_to_recovery_ms": null,
    "time_to_safe_state_ms": null,
    "recovery_attempt_count": 0,
    "tasks_pending_at_first_fault": 1,
    "tasks_recovered_after_fault": 1,
    "fault_to_safe_state_event_count": 0,
    "fault_to_recovery_event_count": 0
  },
  "safety": {
    "safety_violation_count": 0,
    "safety_violation_types": [],
    "ponr_violation_count": 0,
    "unsafe_completion_count": 0,
    "unsafe_success_count": 0,
    "constraint_violation_count": 0,
    "deadline_miss_count": 0,
    "resource_conflict_count": 0,
    "invalid_action_count": 0,
    "blocked_action_count": 0
  },
  "coordination_efficiency": {
    "messages_per_completed_task": 2.0,
    "messages_after_fault": 2,
    "retries_per_completed_task": 0.0,
    "duplicate_action_count": 0,
    "wasted_action_count": 0
  },
  "faults": {
    "fault_injected": true,
    "fault_events": [
      "drop_completion",
      "drop_completion"
    ],
    "recovery_ok": true
  },
  "notes": "MAESTRO_REPORT v0.2; thin-slice synthetic trace times (ts) are scenario simulation timestamps in seconds, not wall-clock unless the harness records wall time in ts."
}
